{"format":"ctsc.registry","formatVersion":"0.4.0","registryId":"urn:ctsc:registry:fixture.scalar_types","version":"0.1.0","components":[{"id":"fixture.scalar_types","operations":[{"name":"classify","inputs":[{"name":"id","type":{"kind":"primitive","name":"i64"}},{"name":"active","type":{"kind":"primitive","name":"bool"}}],"observations":[],"outcomes":{"result":{"kind":"named","name":"ScalarValue"}}}],"types":[{"name":"ScalarValue","kind":"tagged_union","variants":[{"name":"Integer","payload":{"kind":"record","fields":[{"name":"value","type":{"kind":"primitive","name":"i64"}}]}},{"name":"Boolean","payload":{"kind":"record","fields":[{"name":"value","type":{"kind":"primitive","name":"bool"}}]}}]}]}]}