{"format":"ctsc.registry","formatVersion":"0.4.0","registryId":"urn:ctsc:registry:fixture.catch_all","version":"0.1.0","components":[{"id":"fixture.catch_all","operations":[{"name":"require_in_range","inputs":[{"name":"x","type":{"kind":"primitive","name":"i32"}}],"observations":[],"outcomes":{"result":{"kind":"primitive","name":"i32"},"errors":[{"name":"error","type":{"kind":"primitive","name":"string"}}]}}],"types":[]}]}