{"format":"ctsc.registry","formatVersion":"0.4.0","registryId":"urn:ctsc:registry:fixture.scalar_operators","version":"0.1.0","components":[{"id":"fixture.scalar_operators","operations":[{"name":"get_empty","inputs":[],"observations":[],"outcomes":{"result":{"kind":"collection","items":{"kind":"primitive","name":"string"},"ordered":true,"unique":false}}},{"name":"get_measurement","inputs":[],"observations":[],"outcomes":{"result":{"kind":"named","name":"Measurement"}}}],"types":[{"name":"Measurement","kind":"record","fields":[{"name":"temperature","type":{"kind":"primitive","name":"i32"}},{"name":"label","type":{"kind":"primitive","name":"string"}},{"name":"readings","type":{"kind":"collection","items":{"kind":"primitive","name":"i32"},"ordered":true,"unique":false}}]}]}]}