{"format":"ctsc.registry","formatVersion":"0.4.0","registryId":"urn:ctsc:registry:fixture.multi_step","version":"0.1.0","components":[{"id":"fixture.multi_step","operations":[{"name":"decrement","inputs":[],"observations":[],"outcomes":{},"extensions":{"dev.specgate.setups":[{"fills":"","inputs":[],"output":"Counter"}]}},{"name":"increment","inputs":[],"observations":[],"outcomes":{},"extensions":{"dev.specgate.setups":[{"fills":"","inputs":[],"output":"Counter"}]}},{"name":"observe_count","inputs":[{"name":"operation","type":{"kind":"primitive","name":"string"}},{"name":"count","type":{"kind":"primitive","name":"i32"}}],"observations":[],"outcomes":{"result":{"kind":"primitive","name":"i32"}}}],"types":[{"name":"Counter","kind":"record","fields":[{"name":"count","type":{"kind":"primitive","name":"i32"}}]}]}]}