{"format":"ctsc.registry","formatVersion":"0.4.0","registryId":"urn:ctsc:registry:fixture.structured_map","version":"0.1.0","components":[{"id":"fixture.structured_map","operations":[{"name":"get_entity_values","inputs":[{"name":"id","type":{"kind":"primitive","name":"i32"}}],"observations":[],"outcomes":{"result":{"kind":"map","keys":{"kind":"primitive","name":"string"},"values":{"kind":"primitive","name":"string"},"ordered":false}}}],"types":[]}]}