{"format":"ctsc.registry","formatVersion":"0.4.0","registryId":"urn:ctsc:registry:fixture.async_abandon","version":"0.1.0","components":[{"id":"fixture.async_abandon","operations":[{"name":"abandon","inputs":[{"name":"value","type":{"kind":"primitive","name":"i32"}}],"observations":[],"outcomes":{"result":{"kind":"primitive","name":"i32"}}},{"name":"work","inputs":[{"name":"value","type":{"kind":"primitive","name":"i32"}}],"observations":[],"outcomes":{"result":{"kind":"primitive","name":"i32"}}}],"types":[]}]}