{"format":"ctsc.registry","formatVersion":"0.4.0","registryId":"urn:ctsc:registry:fixture.fallible_unit","version":"0.1.0","components":[{"id":"fixture.fallible_unit","operations":[{"name":"advance","inputs":[{"name":"initial","type":{"kind":"primitive","name":"i32"}}],"observations":[],"outcomes":{},"extensions":{"dev.specgate.setups":[{"fills":"","inputs":[{"name":"initial","ty":"i32"}],"output":"UnitCounter"}]}},{"name":"fallible_task","inputs":[{"name":"fail","type":{"kind":"primitive","name":"bool"}}],"observations":[],"outcomes":{"errors":[{"name":"error","type":{"kind":"primitive","name":"string"}}]}},{"name":"fallible_void","inputs":[{"name":"fail","type":{"kind":"primitive","name":"bool"}}],"observations":[],"outcomes":{"errors":[{"name":"error","type":{"kind":"primitive","name":"string"}}]}}],"types":[{"name":"UnitCounter","kind":"record","fields":[{"name":"count","type":{"kind":"primitive","name":"i32"}}]}]}]}