{"format":"ctsc.registry","formatVersion":"0.4.0","registryId":"urn:ctsc:registry:fixture.shared_setup","version":"0.1.0","components":[{"id":"fixture.shared_setup","operations":[{"name":"combine","inputs":[],"observations":[],"outcomes":{"result":{"kind":"primitive","name":"i32"}},"extensions":{"dev.specgate.setups":[{"fills":"left","inputs":[],"output":"BoxVal"},{"fills":"right","inputs":[],"output":"BoxVal"}]}},{"name":"combine_three","inputs":[],"observations":[],"outcomes":{"result":{"kind":"primitive","name":"i32"}},"extensions":{"dev.specgate.setups":[{"fills":"a","inputs":[],"output":"BoxVal"},{"fills":"b","inputs":[],"output":"BoxVal"},{"fills":"c","inputs":[],"output":"BoxVal"}]}}],"types":[{"name":"BoxVal","kind":"record","fields":[{"name":"value","type":{"kind":"primitive","name":"i32"}}]}]}]}