{"format":"ctsc.registry","formatVersion":"0.4.0","registryId":"urn:ctsc:registry:fixture.named_inputs","version":"0.1.0","components":[{"id":"fixture.named_inputs","operations":[{"name":"divide","inputs":[{"name":"numerator","type":{"kind":"primitive","name":"i32"}},{"name":"denominator","type":{"kind":"primitive","name":"i32"}}],"observations":[],"outcomes":{"result":{"kind":"primitive","name":"i32"}}},{"name":"scale","inputs":[{"name":"factor","type":{"kind":"primitive","name":"i32"}},{"name":"value","type":{"kind":"primitive","name":"i32"}}],"observations":[],"outcomes":{"result":{"kind":"primitive","name":"i32"}},"extensions":{"dev.specgate.setups":[{"fills":"","inputs":[{"name":"factor","ty":"i32"}],"output":"Scaler"}]}}],"types":[{"name":"Scaler","kind":"record","fields":[{"name":"factor","type":{"kind":"primitive","name":"i32"}}]}]}]}