{"format":"ctsc.registry","formatVersion":"0.4.0","registryId":"urn:ctsc:registry:fixture.statemachine_counter","version":"0.1.0","components":[{"id":"fixture.statemachine_counter","operations":[{"name":"increment","inputs":[],"observations":[],"outcomes":{},"extensions":{"dev.specgate.setups":[{"fills":"","inputs":[],"output":"Counter"}]}},{"name":"observe_state","inputs":[{"name":"counter","type":{"kind":"named","name":"Counter"}}],"observations":[],"outcomes":{"result":{"kind":"named","name":"Counter"}}}],"types":[{"name":"Counter","kind":"record","fields":[{"name":"count","type":{"kind":"primitive","name":"i32"}}]}]}]}