{"format":"ctsc.registry","formatVersion":"0.4.0","registryId":"urn:ctsc:registry:fixture.option_none","version":"0.1.0","components":[{"id":"fixture.option_none","operations":[{"name":"find","inputs":[{"name":"items","type":{"kind":"collection","items":{"kind":"primitive","name":"i32"},"ordered":true,"unique":false}},{"name":"target","type":{"kind":"primitive","name":"i32"}}],"observations":[],"outcomes":{"result":{"kind":"primitive","name":"i32"},"empty":true}}],"types":[]}]}