{"format":"ctsc.registry","formatVersion":"0.4.0","registryId":"urn:ctsc:registry:fixture.void_operation","version":"0.1.0","components":[{"id":"fixture.void_operation","operations":[{"name":"log","inputs":[{"name":"msg","type":{"kind":"primitive","name":"string"}}],"observations":[],"outcomes":{},"extensions":{"dev.specgate.setups":[{"fills":"","inputs":[],"output":"Logger"}]}},{"name":"observe_count","inputs":[{"name":"count","type":{"kind":"primitive","name":"i32"}}],"observations":[],"outcomes":{"result":{"kind":"primitive","name":"i32"}}}],"types":[{"name":"Logger","kind":"record","fields":[{"name":"count","type":{"kind":"primitive","name":"i32"}}]}]}]}