{"format":"ctsc.registry","formatVersion":"0.4.0","registryId":"urn:ctsc:registry:fixture.unrecoverable","version":"0.1.0","components":[{"id":"fixture.unrecoverable","operations":[{"name":"divide","inputs":[{"name":"a","type":{"kind":"primitive","name":"i32"}},{"name":"b","type":{"kind":"primitive","name":"i32"}}],"observations":[],"outcomes":{"result":{"kind":"primitive","name":"i32"}}}],"types":[]}]}