{"format":"ctsc.registry","formatVersion":"0.4.0","registryId":"urn:ctsc:registry:fixture.default_input","version":"0.1.0","components":[{"id":"fixture.default_input","operations":[{"name":"scale","inputs":[{"name":"value","type":{"kind":"primitive","name":"i32"}},{"name":"factor","type":{"kind":"primitive","name":"i32"}}],"observations":[],"outcomes":{"result":{"kind":"primitive","name":"i32"}}},{"name":"shift","inputs":[{"name":"base","type":{"kind":"primitive","name":"i32"}},{"name":"by","type":{"kind":"named","name":"Offset"}}],"observations":[],"outcomes":{"result":{"kind":"primitive","name":"i32"}}}],"types":[{"name":"Offset","kind":"record","fields":[{"name":"dx","type":{"kind":"primitive","name":"i32"}},{"name":"dy","type":{"kind":"primitive","name":"i32"}}]}]}]}