{"format":"ctsc.registry","formatVersion":"0.4.0","registryId":"urn:ctsc:registry:fixture.mock_field","version":"0.1.0","components":[{"id":"fixture.mock_field","operations":[{"name":"get_user","inputs":[{"name":"id","type":{"kind":"primitive","name":"string"}}],"observations":[],"outcomes":{"result":{"kind":"primitive","name":"string"},"errors":[{"name":"error","type":{"kind":"primitive","name":"string"}}]}},{"name":"lookup_user","inputs":[{"name":"id","type":{"kind":"primitive","name":"string"}}],"observations":[],"outcomes":{"result":{"kind":"primitive","name":"string"},"empty":true}}],"types":[]}]}