{"format":"ctsc.registry","formatVersion":"0.4.0","registryId":"urn:ctsc:registry:fixture.operators","version":"0.1.0","components":[{"id":"fixture.operators","operations":[{"name":"get_product","inputs":[],"observations":[],"outcomes":{"result":{"kind":"named","name":"Product"}}}],"types":[{"name":"Product","kind":"record","fields":[{"name":"product_name","type":{"kind":"primitive","name":"string"}},{"name":"price","type":{"kind":"primitive","name":"i32"}},{"name":"tags","type":{"kind":"collection","items":{"kind":"primitive","name":"string"},"ordered":true,"unique":false}},{"name":"attributes","type":{"kind":"map","keys":{"kind":"primitive","name":"string"},"values":{"kind":"primitive","name":"string"},"ordered":false}}]}]}]}