{"format":"ctsc.registry","formatVersion":"0.4.0","registryId":"urn:ctsc:registry:fixture.property_add","version":"0.1.0","components":[{"id":"fixture.property_add","operations":[{"name":"add","inputs":[{"name":"a","type":{"kind":"primitive","name":"i32"}},{"name":"b","type":{"kind":"primitive","name":"i32"}}],"observations":[],"outcomes":{"result":{"kind":"primitive","name":"i32"}}}],"types":[]}]}