{"format":"ctsc.registry","formatVersion":"0.4.0","registryId":"urn:ctsc:registry:comp.core","version":"0.1.0","components":[{"id":"comp.core","operations":[{"name":"make_widget","inputs":[],"observations":[],"outcomes":{"result":{"kind":"named","name":"Widget"}}}],"types":[{"name":"Widget","kind":"record","fields":[{"name":"id","type":{"kind":"primitive","name":"i32"}},{"name":"label","type":{"kind":"primitive","name":"string"}}]}]}]}