{"format":"ctsc.registry","formatVersion":"0.4.0","registryId":"urn:ctsc:registry:fixture.async_migration","version":"0.1.0","components":[{"id":"fixture.async_migration","operations":[{"name":"fetch","inputs":[{"name":"url","type":{"kind":"primitive","name":"string"}}],"observations":[],"outcomes":{"result":{"kind":"primitive","name":"string"}}},{"name":"migrate","inputs":[{"name":"url","type":{"kind":"primitive","name":"string"}}],"observations":[],"outcomes":{"result":{"kind":"primitive","name":"string"}}}],"types":[]}]}