{"format":"ctsc.registry","formatVersion":"0.4.0","registryId":"urn:ctsc:registry:fixture.rich","version":"0.1.0","components":[{"id":"fixture.rich","operations":[{"name":"describe","inputs":[{"name":"person","type":{"kind":"named","name":"Person"}},{"name":"fallback","type":{"kind":"optional","value":{"kind":"named","name":"Shape"}}}],"observations":[],"outcomes":{"result":{"kind":"primitive","name":"string"},"empty":true}},{"name":"tag_count","inputs":[{"name":"tags","type":{"kind":"collection","items":{"kind":"primitive","name":"string"},"ordered":true,"unique":false}}],"observations":[],"outcomes":{"result":{"kind":"primitive","name":"i32"}}}],"types":[{"name":"Address","kind":"record","fields":[{"name":"street","type":{"kind":"primitive","name":"string"}},{"name":"city","type":{"kind":"primitive","name":"string"}}]},{"name":"Person","kind":"record","fields":[{"name":"name","type":{"kind":"primitive","name":"string"}},{"name":"address","type":{"kind":"named","name":"Address"}},{"name":"tags","type":{"kind":"collection","items":{"kind":"primitive","name":"string"},"ordered":true,"unique":false}},{"name":"scores","type":{"kind":"map","keys":{"kind":"primitive","name":"string"},"values":{"kind":"primitive","name":"i32"},"ordered":false}},{"name":"aliases","type":{"kind":"collection","items":{"kind":"primitive","name":"string"},"ordered":false,"unique":true}},{"name":"nickname","type":{"kind":"optional","value":{"kind":"primitive","name":"string"}}}]},{"name":"Shape","kind":"tagged_union","variants":[{"name":"Circle","payload":{"kind":"record","fields":[{"name":"radius","type":{"kind":"primitive","name":"i32"}}]}},{"name":"Rectangle","payload":{"kind":"record","fields":[{"name":"width","type":{"kind":"primitive","name":"i32"}},{"name":"height","type":{"kind":"primitive","name":"i32"}}]}},{"name":"Point"}]}]}]}