{"format":"ctsc.registry","formatVersion":"0.4.0","registryId":"urn:ctsc:registry:fixture.complex_inputs","version":"0.1.0","components":[{"id":"fixture.complex_inputs","operations":[{"name":"area_of_shape","inputs":[{"name":"shape","type":{"kind":"named","name":"Shape"}}],"observations":[],"outcomes":{"result":{"kind":"primitive","name":"i32"}}},{"name":"classify","inputs":[{"name":"sides","type":{"kind":"primitive","name":"i32"}}],"observations":[],"outcomes":{"result":{"kind":"named","name":"Shape"}}},{"name":"create_enum_type","inputs":[{"name":"name","type":{"kind":"primitive","name":"string"}},{"name":"members","type":{"kind":"collection","items":{"kind":"named","name":"EnumMemberInput"},"ordered":true,"unique":false}}],"observations":[],"outcomes":{"result":{"kind":"primitive","name":"string"}}},{"name":"create_person","inputs":[{"name":"name","type":{"kind":"primitive","name":"string"}},{"name":"age","type":{"kind":"primitive","name":"i32"}},{"name":"street","type":{"kind":"primitive","name":"string"}},{"name":"city","type":{"kind":"primitive","name":"string"}}],"observations":[],"outcomes":{"result":{"kind":"named","name":"Person"}}},{"name":"describe_config","inputs":[{"name":"config","type":{"kind":"named","name":"AppConfig"}}],"observations":[],"outcomes":{"result":{"kind":"primitive","name":"string"}}},{"name":"describe_person","inputs":[{"name":"person","type":{"kind":"named","name":"Person"}}],"observations":[],"outcomes":{"result":{"kind":"primitive","name":"string"}}},{"name":"find_point","inputs":[{"name":"points","type":{"kind":"collection","items":{"kind":"named","name":"Point"},"ordered":true,"unique":false}},{"name":"target_x","type":{"kind":"primitive","name":"i32"}}],"observations":[],"outcomes":{"result":{"kind":"named","name":"Point"},"empty":true}},{"name":"find_shape","inputs":[{"name":"sides","type":{"kind":"primitive","name":"i32"}}],"observations":[],"outcomes":{"result":{"kind":"named","name":"Shape"},"empty":true}},{"name":"first_member","inputs":[{"name":"members","type":{"kind":"collection","items":{"kind":"named","name":"EnumMemberInput"},"ordered":true,"unique":false}}],"observations":[],"outcomes":{"result":{"kind":"primitive","name":"string"}}},{"name":"get_points_on_line","inputs":[{"name":"count","type":{"kind":"primitive","name":"i32"}}],"observations":[],"outcomes":{"result":{"kind":"collection","items":{"kind":"named","name":"Point"},"ordered":true,"unique":false}}},{"name":"greet_optional","inputs":[{"name":"name","type":{"kind":"optional","value":{"kind":"primitive","name":"string"}}}],"observations":[],"outcomes":{"result":{"kind":"primitive","name":"string"}}},{"name":"invert_map","inputs":[{"name":"table","type":{"kind":"map","keys":{"kind":"primitive","name":"string"},"values":{"kind":"primitive","name":"i32"},"ordered":false}}],"observations":[],"outcomes":{"result":{"kind":"map","keys":{"kind":"primitive","name":"string"},"values":{"kind":"primitive","name":"string"},"ordered":false}}},{"name":"lookup","inputs":[{"name":"table","type":{"kind":"map","keys":{"kind":"primitive","name":"string"},"values":{"kind":"primitive","name":"i32"},"ordered":false}},{"name":"key","type":{"kind":"primitive","name":"string"}}],"observations":[],"outcomes":{"result":{"kind":"primitive","name":"i32"}}},{"name":"member_count","inputs":[{"name":"members","type":{"kind":"collection","items":{"kind":"named","name":"EnumMemberInput"},"ordered":true,"unique":false}}],"observations":[],"outcomes":{"result":{"kind":"primitive","name":"i32"}}},{"name":"sum_points","inputs":[{"name":"points","type":{"kind":"collection","items":{"kind":"named","name":"Point"},"ordered":true,"unique":false}}],"observations":[],"outcomes":{"result":{"kind":"named","name":"Point"}}}],"types":[{"name":"Address","kind":"record","fields":[{"name":"street","type":{"kind":"primitive","name":"string"}},{"name":"city","type":{"kind":"primitive","name":"string"}}]},{"name":"AppConfig","kind":"record","fields":[{"name":"name","type":{"kind":"primitive","name":"string"}},{"name":"max_retries","type":{"kind":"primitive","name":"i32"}},{"name":"verbose","type":{"kind":"primitive","name":"bool"}}]},{"name":"EnumMemberInput","kind":"record","fields":[{"name":"name","type":{"kind":"primitive","name":"string"}},{"name":"value","type":{"kind":"primitive","name":"string"}}]},{"name":"Person","kind":"record","fields":[{"name":"name","type":{"kind":"primitive","name":"string"}},{"name":"age","type":{"kind":"primitive","name":"i32"}},{"name":"address","type":{"kind":"named","name":"Address"}}]},{"name":"Point","kind":"record","fields":[{"name":"x","type":{"kind":"primitive","name":"i32"}},{"name":"y","type":{"kind":"primitive","name":"i32"}}]},{"name":"Shape","kind":"tagged_union","variants":[{"name":"Circle","payload":{"kind":"record","fields":[{"name":"radius","type":{"kind":"primitive","name":"i32"}}]}},{"name":"Rectangle","payload":{"kind":"record","fields":[{"name":"width","type":{"kind":"primitive","name":"i32"}},{"name":"height","type":{"kind":"primitive","name":"i32"}}]}},{"name":"Point"}]}]}]}